<?xml version="1.0" encoding="utf-8"?>

<phpdocumentor
        version="3"
        xmlns:xsi="http://www.w3.org/2001/XMLSchema-instance" xmlns="http://www.phpdoc.org"
        xsi:noNamespaceSchemaLocation="phpdoc.xsd"
        >
    <paths>
        <output>build/docs</output>
        <cache>/tmp/phpdoc-doc-cache</cache>
    </paths>
    <version number="1.0.0">
        <folder></folder>
        <api format="php">
            <source dsn="file://.">
                <path>src</path>
            </source>
            <ignore hidden="true" symlinks="true">
                <path>src</path>
            </ignore>
            <extensions>
                <extension>php</extension>
                <extension>php3</extension>
                <extension>phtml</extension>
            </extensions>
            <visibility>public</visibility>
            <default-package-name>Default</default-package-name>
            <markers>
                <marker>TODO</marker>
                <marker>FIXME</marker>
            </markers>
        </api>
        <guide format="rst">
            <source dsn="file://../phpDocumentor/phpDocumentor2">
                <path>docs</path>
            </source>
        </guide>
    </version>
    <template name="clean"/>
</phpdocumentor>
