<?xml version="1.0" encoding="UTF-8" ?>
<phpdocumentor
        configVersion="3"
        xmlns:xsi="http://www.w3.org/2001/XMLSchema-instance"
        xmlns="https://www.phpdoc.org"
        xsi:noNamespaceSchemaLocation="data/xsd/phpdoc.xsd"
>
    <paths>
        <output>.phpdoc/build</output>
        <cache>.phpdoc/cache</cache>
    </paths>
    <version number="1.0.0">
        <api>
            <source dsn=".">
                <path>src</path>
            </source>
        </api>
    </version>
    <extension name="my_extension">
        <custom-option>hello</custom-option>
    </extension>
</phpdocumentor>
