<?xml version="1.0" encoding="UTF-8" ?>
<phpdocumentor
        configVersion="3"
        xmlns:xsi="http://www.w3.org/2001/XMLSchema-instance"
        xmlns="https://www.phpdoc.org"
        xsi:noNamespaceSchemaLocation="../../../../../data/xsd/phpdoc.xsd"
>
    <title>GuidesDirectives fixture</title>
    <paths>
        <output>build</output>
    </paths>
    <version number="1.0.0">
        <folder>latest</folder>
        <api>
            <source dsn=".">
                <path>src</path>
            </source>
            <output>api</output>
        </api>
        <guide>
            <source dsn=".">
                <path>docs</path>
            </source>
            <output>/guide</output>
        </guide>
    </version>
    <setting name="guides.enabled" value="true"/>
</phpdocumentor>
